{
  "asset_id": "a1b2c3d4-e5f6-7890-abcd-ef1234567890",
  "title": "TEAE Summary by SOC and PT - Standard Template",
  "description": "Produces a frequency table of treatment-emergent adverse events grouped by System Organ Class and Preferred Term, with subject counts and percentages per treatment group.",
  "asset_type": "code",
  "language": "sas",
  "status": "draft",
  "tags": ["ae_summary", "teae", "soc", "pt", "frequency_table"],
  "task_types": ["ae_summary"],
  "created_by": "example_user",
  "created_at": "2026-04-08T12:00:00Z",
  "version": "1.0.0",
  "file_path": "draft_library/generated_code/a1b2c3d4-e5f6-7890-abcd-ef1234567890.sas",
  "dependencies": [],
  "source_doc": "SAP_STUDY001_v2.0"
}
